{
  "$schema": "https://nativecn.dev/schemas/registry.json",
  "name": "nativecn",
  "title": "NativeCN SwiftUI",
  "description": "Registry metadata for NativeCN SwiftUI source ownership workflows.",
  "registryVersion": 1,
  "packageVersion": "0.9.0",
  "swiftToolsVersion": "5.9",
  "minimumPlatforms": {
    "iOS": "16.0",
    "macOS": "13.0"
  },
  "copyPasteRoot": "AppUI/NativeCN",
  "docs": "Docs/Registry.md",
  "items": [
    { "name": "tokens", "type": "foundation", "path": "Registry/components/tokens.json" },
    { "name": "theme", "type": "foundation", "path": "Registry/components/theme.json" },
    { "name": "primitives", "type": "foundation", "path": "Registry/components/primitives.json" },
    { "name": "button", "type": "component", "path": "Registry/components/button.json" },
    { "name": "badge", "type": "component", "path": "Registry/components/badge.json" },
    { "name": "card", "type": "component", "path": "Registry/components/card.json" },
    { "name": "separator", "type": "component", "path": "Registry/components/separator.json" },
    { "name": "label", "type": "component", "path": "Registry/components/label.json" },
    { "name": "field", "type": "component", "path": "Registry/components/field.json" },
    { "name": "input", "type": "component", "path": "Registry/components/input.json" },
    { "name": "input-otp", "type": "component", "path": "Registry/components/input-otp.json" },
    { "name": "avatar", "type": "component", "path": "Registry/components/avatar.json" },
    { "name": "skeleton", "type": "component", "path": "Registry/components/skeleton.json" },
    { "name": "progress", "type": "component", "path": "Registry/components/progress.json" },
    { "name": "spinner", "type": "component", "path": "Registry/components/spinner.json" },
    { "name": "textarea", "type": "component", "path": "Registry/components/textarea.json" },
    { "name": "switch", "type": "component", "path": "Registry/components/switch.json" },
    { "name": "toggle", "type": "component", "path": "Registry/components/toggle.json" },
    { "name": "toggle-group", "type": "component", "path": "Registry/components/toggle-group.json" },
    { "name": "slider", "type": "component", "path": "Registry/components/slider.json" },
    { "name": "checkbox", "type": "component", "path": "Registry/components/checkbox.json" },
    { "name": "radio-group", "type": "component", "path": "Registry/components/radio-group.json" },
    { "name": "select", "type": "component", "path": "Registry/components/select.json" },
    { "name": "combobox", "type": "component", "path": "Registry/components/combobox.json" },
    { "name": "alert", "type": "component", "path": "Registry/components/alert.json" },
    { "name": "dialog", "type": "component", "path": "Registry/components/dialog.json" },
    { "name": "alert-dialog", "type": "component", "path": "Registry/components/alert-dialog.json" },
    { "name": "sheet", "type": "component", "path": "Registry/components/sheet.json" },
    { "name": "drawer", "type": "component", "path": "Registry/components/drawer.json" },
    { "name": "toast", "type": "component", "path": "Registry/components/toast.json" },
    { "name": "popover", "type": "component", "path": "Registry/components/popover.json" },
    { "name": "tooltip", "type": "component", "path": "Registry/components/tooltip.json" },
    { "name": "hover-card", "type": "component", "path": "Registry/components/hover-card.json" },
    { "name": "dropdown-menu", "type": "component", "path": "Registry/components/dropdown-menu.json" },
    { "name": "menubar", "type": "component", "path": "Registry/components/menubar.json" },
    { "name": "page-header", "type": "component", "path": "Registry/components/page-header.json" },
    { "name": "section", "type": "component", "path": "Registry/components/section.json" },
    { "name": "list-row", "type": "component", "path": "Registry/components/list-row.json" },
    { "name": "empty-state", "type": "component", "path": "Registry/components/empty-state.json" },
    { "name": "aspect-ratio", "type": "component", "path": "Registry/components/aspect-ratio.json" },
    { "name": "scroll-area", "type": "component", "path": "Registry/components/scroll-area.json" },
    { "name": "resizable-panels", "type": "component", "path": "Registry/components/resizable-panels.json" },
    { "name": "carousel", "type": "component", "path": "Registry/components/carousel.json" },
    { "name": "breadcrumb", "type": "component", "path": "Registry/components/breadcrumb.json" },
    { "name": "tabs", "type": "component", "path": "Registry/components/tabs.json" },
    { "name": "segmented-control", "type": "component", "path": "Registry/components/segmented-control.json" },
    { "name": "navigation-menu", "type": "component", "path": "Registry/components/navigation-menu.json" },
    { "name": "sidebar", "type": "component", "path": "Registry/components/sidebar.json" },
    { "name": "stat", "type": "component", "path": "Registry/components/stat.json" },
    { "name": "description-list", "type": "component", "path": "Registry/components/description-list.json" },
    { "name": "timeline", "type": "component", "path": "Registry/components/timeline.json" },
    { "name": "status-badge", "type": "component", "path": "Registry/components/status-badge.json" },
    { "name": "resource-list", "type": "component", "path": "Registry/components/resource-list.json" },
    { "name": "data-table", "type": "component", "path": "Registry/components/data-table.json" },
    { "name": "pagination", "type": "component", "path": "Registry/components/pagination.json" },
    { "name": "callout", "type": "component", "path": "Registry/components/callout.json" },
    { "name": "note", "type": "component", "path": "Registry/components/note.json" },
    { "name": "code-block", "type": "component", "path": "Registry/components/code-block.json" },
    { "name": "inline-code", "type": "component", "path": "Registry/components/inline-code.json" },
    { "name": "keyboard-shortcut", "type": "component", "path": "Registry/components/keyboard-shortcut.json" },
    { "name": "accordion", "type": "component", "path": "Registry/components/accordion.json" },
    { "name": "collapsible", "type": "component", "path": "Registry/components/collapsible.json" },
    { "name": "context-menu", "type": "component", "path": "Registry/components/context-menu.json" },
    { "name": "command", "type": "component", "path": "Registry/components/command.json" },
    { "name": "calendar", "type": "component", "path": "Registry/components/calendar.json" }
  ]
}
